{
  "id": "deadline-zero-player-idle",
  "project": "deadline-zero",
  "type": "sprite",
  "importance": "primary",
  "source": {
    "mode": "custom",
    "uri": null,
    "author": null
  },
  "license": {
    "id": "project-owned",
    "commercialUse": true,
    "derivatives": true,
    "attributionRequired": false
  },
  "target": {
    "engine": "godot",
    "format": "png",
    "maxBytes": 524288
  },
  "constraints": {
    "pixelArt": true,
    "frameWidth": 32,
    "frameHeight": 32,
    "interpolation": "nearest"
  }
}
